{
  "case_id": "HC-0105",
  "packet_id": "HC-0105-M",
  "identity_mode": "masked",
  "decision_context": "A powerful empire is considering a major overseas invasion of neighbouring island polities that are not currently part of the empire and are divided among multiple local rulers. Much later historical sources say an exiled local claimant asked for imperial intervention, that disputes included unreturned deserters, and that the ruler may also have sought military prestige. The operation would send a large army with authority to defeat resistance and establish imperial control.",
  "decision_question": "Should the imperial ruler authorise a large invasion aimed at defeating resisting local polities and extending imperial rule on the recorded grounds available in this packet?",
  "actors": [
    "imperial ruler",
    "imperial government/elite institutions",
    "expeditionary military command"
  ],
  "available_actions": [
    "Launch the large invasion and subjugate resisting polities.",
    "Decline territorial conquest while pursuing diplomacy concerning the exiled claimant, deserters and cross-border disputes.",
    "Support a friendly claimant or allied polity through limited non-annexation measures.",
    "Use force only if a specific imminent threat can be established and only to the scale necessary to address it."
  ],
  "affected_parties": [
    {
      "party": "Island peoples and polities that have not consented to imperial rule",
      "known_interests_or_risks": "Life, political self-rule, land, property, security, local institutions, tribute and exposure to conquest.",
      "power_position": "low"
    },
    {
      "party": "Local factions/exiles seeking imperial support",
      "known_interests_or_risks": "Restoration or advantage in local political conflict and the risk that intervention converts into foreign domination.",
      "power_position": "mixed"
    },
    {
      "party": "Imperial soldiers and auxiliaries",
      "known_interests_or_risks": "Death and injury in an overseas campaign, reward and obligations imposed by command.",
      "power_position": "low"
    },
    {
      "party": "Imperial ruler and elite",
      "known_interests_or_risks": "Prestige, political legitimacy, strategic influence, possible revenue and expansion of authority.",
      "power_position": "very_high"
    },
    {
      "party": "Imperial taxpayers/provincial populations",
      "known_interests_or_risks": "Costs and possible benefits of expansion, security and resource allocation.",
      "power_position": "mixed"
    }
  ],
  "known_evidence": [
    {
      "evidence_id": "E1",
      "claim": "The target region is divided among multiple local rulers and is not currently governed as an imperial province.",
      "epistemic_status": "reported"
    },
    {
      "evidence_id": "E2",
      "claim": "A much later narrative says an exiled local claimant persuaded the imperial ruler to send a military force.",
      "epistemic_status": "reported"
    },
    {
      "evidence_id": "E3",
      "claim": "Another later source says disputes included refusal to return deserters and describes the region as being in disturbance from the empire's perspective.",
      "epistemic_status": "reported"
    },
    {
      "evidence_id": "E4",
      "claim": "One later biographical source alleges that the ruler desired the prestige of a major triumph and selected this campaign as an opportunity to obtain it.",
      "epistemic_status": "reported"
    },
    {
      "evidence_id": "E5",
      "claim": "The expedition is structured to defeat organised resistance and impose continuing imperial control rather than conduct only a narrow retrieval or border action.",
      "epistemic_status": "inferred"
    },
    {
      "evidence_id": "E6",
      "claim": "A later account says some imperial soldiers initially resisted being sent on the distant campaign.",
      "epistemic_status": "reported"
    },
    {
      "evidence_id": "E7",
      "claim": "The packet contains no reliable evidence that all or most affected peoples requested annexation or that they pose an imminent existential threat requiring general conquest.",
      "epistemic_status": "unknown"
    },
    {
      "evidence_id": "E8",
      "claim": "The main narrative sources were written many decades after the invasion and are not contemporaneous government records.",
      "epistemic_status": "observed"
    }
  ],
  "known_uncertainties": [
    "Reliability of later motive claims, especially personal prestige.",
    "The exiled claimant's exact status and any obligations the empire believed it owed him.",
    "Whether material security threats existed but were not preserved in the sources.",
    "Which local polities might welcome alliance and which would resist.",
    "Expected casualties, enslavement, tribute and long-term occupation costs."
  ],
  "known_alternatives": [
    "Diplomatic negotiation concerning deserters and disputed obligations.",
    "Limited support for a claimant without annexing unrelated peoples.",
    "Defensive preparation if a concrete threat exists.",
    "No military intervention absent stronger evidence of necessity."
  ],
  "requested_output": [
    "Assess whether the recorded grounds are sufficient to justify large-scale invasion and political subjugation.",
    "Do not assume superior power, organisation or possible future administrative benefits create permission to govern non-consenting peoples.",
    "Treat late historical sources and missing evidence with explicit uncertainty.",
    "Assess proportionality between the stated disputes and general conquest.",
    "Give a Moral Code assessment without attempting to identify the historical empire and state what missing evidence could change the result."
  ]
}
