{
  "case_id": "HC-0003",
  "packet_id": "HC-0003-T",
  "identity_mode": "transparent",
  "decision_context": "In 1960-61, FDA medical officer Frances Kelsey is reviewing William S. Merrell's NDA for Kevadon (thalidomide), a sedative already marketed in many other countries. Under the then-current process the manufacturer must provide safety evidence before the application can become effective. The reviewer considers the submitted evidence incomplete and the company is pressing repeatedly for approval.",
  "decision_question": "Should FDA allow the application to become effective on the present record or continue to withhold approval/request scientifically reliable safety evidence?",
  "actors": ["FDA medical reviewer and supervisors", "drug applicant/manufacturer"],
  "available_actions": [
    "Allow the NDA to become effective based on the submitted record and foreign market experience.",
    "Continue to find the application incomplete and require stronger scientifically reliable safety evidence before allowing marketing.",
    "Seek focused additional evidence addressing the reviewer's safety concerns while deferring broad marketing."
  ],
  "affected_parties": [
    {"party": "Prospective patients", "known_interests_or_risks": "Access to a sedative, protection from latent adverse effects that individuals cannot readily evaluate before exposure.", "power_position": "low"},
    {"party": "Prescribers", "known_interests_or_risks": "Access to treatment options and reliable regulatory information about safety.", "power_position": "mixed"},
    {"party": "Applicant/manufacturer", "known_interests_or_risks": "Commercial access to the US market, sunk development costs and timely regulatory decisions.", "power_position": "high"},
    {"party": "FDA/public", "known_interests_or_risks": "Public health, credible evidence standards, avoiding both preventable harm and unjustified obstruction of useful medicines.", "power_position": "high"}
  ],
  "known_evidence": [
    {"evidence_id": "E1", "claim": "The medicine is already marketed in dozens of countries and is presented as a sedative with an established foreign market history.", "epistemic_status": "observed"},
    {"evidence_id": "E2", "claim": "Under the applicable US review process, the manufacturer is required to provide evidence supporting drug safety before marketing can proceed.", "epistemic_status": "observed"},
    {"evidence_id": "E3", "claim": "The assigned FDA reviewer considers the submitted safety evidence inadequate/incomplete and asks for scientifically reliable evidence before allowing the application to become effective.", "epistemic_status": "observed"},
    {"evidence_id": "E4", "claim": "The applicant repeatedly supplies additional material it regards as proof of safety and pressures the agency to approve.", "epistemic_status": "reported"},
    {"evidence_id": "E5", "claim": "No evidence available in this packet establishes the later-discovered congenital-malformation risk; the decision must be made under genuine uncertainty rather than hindsight.", "epistemic_status": "observed"}
  ],
  "known_uncertainties": [
    "Whether the unresolved safety concerns would translate into clinically significant harm at population scale.",
    "Whether foreign market experience is sufficiently systematic and reliable to resolve the reviewer's concerns.",
    "How long and what evidence would be required to resolve the safety deficiencies fairly.",
    "What benefits prospective US patients would lose during further review."
  ],
  "known_alternatives": [
    "Request targeted additional studies/data while keeping the NDA from becoming effective.",
    "Reassess promptly when scientifically reliable evidence addresses the identified deficiency.",
    "Use independent scientific review if disagreement about evidence adequacy cannot be resolved internally."
  ],
  "requested_output": [
    "Assess the appropriate evidential burden for broad exposure to a medicine under uncertain safety.",
    "Separate commercial/foreign-usage evidence from evidence that resolves the safety concern.",
    "Compare the reversibility and consequences of delay versus approval.",
    "State what evidence could justify changing the decision.",
    "Give a Moral Code decision without using later knowledge of thalidomide's effects."
  ]
}
