{
  "case_id": "HC-0105",
  "packet_id": "HC-0105-T",
  "identity_mode": "transparent",
  "decision_context": "Emperor Claudius is considering a major Roman military expedition to Britain. Britain is not a Roman province and is divided among multiple kingdoms and peoples. Later ancient sources report that an exiled figure named Bericus persuaded Claudius to intervene, that disputes included unreturned deserters, and that Claudius also wanted the prestige of a legitimate triumph. The proposed operation would send a large Roman army across the Channel with authority to defeat resisting British forces and establish Roman control.",
  "decision_question": "Should Claudius authorise a large invasion aimed at defeating resisting British polities and extending Roman rule over substantial parts of Britain on the stated/recorded grounds available to us?",
  "actors": [
    "Emperor Claudius",
    "Roman imperial government and Senate",
    "Roman military command under Aulus Plautius"
  ],
  "available_actions": [
    "Launch the large expeditionary invasion and subjugate resisting British polities.",
    "Decline territorial conquest while pursuing diplomacy concerning the exiled claimant, deserters and cross-Channel disputes.",
    "Support a friendly claimant or allied polity through limited non-annexation measures rather than general conquest.",
    "Use force only if a specific imminent threat to Roman territory or citizens can be established and only to the scale necessary to address that threat."
  ],
  "affected_parties": [
    {
      "party": "British peoples and kingdoms that have not consented to Roman rule",
      "known_interests_or_risks": "Life, political self-rule, land, property, security, local institutions, tribute obligations and exposure to military conquest.",
      "power_position": "low"
    },
    {
      "party": "British factions or exiles seeking Roman support",
      "known_interests_or_risks": "Restoration, protection or advantage in local political conflict, but risk of exchanging local autonomy for Roman domination.",
      "power_position": "mixed"
    },
    {
      "party": "Roman soldiers and auxiliaries",
      "known_interests_or_risks": "Death and injury in an overseas campaign, military reward and obligations imposed by imperial command.",
      "power_position": "low"
    },
    {
      "party": "Roman emperor and elite",
      "known_interests_or_risks": "Prestige, political legitimacy, strategic influence, possible revenue and expansion of imperial authority.",
      "power_position": "very_high"
    },
    {
      "party": "Roman provincial populations and taxpayers",
      "known_interests_or_risks": "Costs and possible benefits of military expansion, future taxation, security and imperial resource allocation.",
      "power_position": "mixed"
    }
  ],
  "known_evidence": [
    {
      "evidence_id": "E1",
      "claim": "Britain is politically divided among multiple local kings and peoples rather than governed as a Roman province.",
      "epistemic_status": "reported"
    },
    {
      "evidence_id": "E2",
      "claim": "A later ancient account says an exiled figure named Bericus, driven from Britain in an uprising, persuaded Claudius to send a Roman force.",
      "epistemic_status": "reported"
    },
    {
      "evidence_id": "E3",
      "claim": "Another later ancient account says disputes included refusal to return certain deserters and characterises Britain as being in disturbance/rebellion from Rome's perspective.",
      "epistemic_status": "reported"
    },
    {
      "evidence_id": "E4",
      "claim": "Suetonius, writing decades later, alleges that Claudius desired the prestige of a legitimate military triumph and selected Britain as an opportunity to obtain it.",
      "epistemic_status": "reported"
    },
    {
      "evidence_id": "E5",
      "claim": "The proposed expedition is large enough to defeat organised resistance and impose Roman control rather than merely conduct a narrow retrieval or border-policing action.",
      "epistemic_status": "inferred"
    },
    {
      "evidence_id": "E6",
      "claim": "The surviving account reports that Roman soldiers initially resisted the prospect of an overseas campaign beyond what they regarded as the familiar world.",
      "epistemic_status": "reported"
    },
    {
      "evidence_id": "E7",
      "claim": "No surviving evidence in this packet establishes that all or most affected British peoples invited Roman annexation or that Britain posed an imminent existential threat to Rome requiring general conquest.",
      "epistemic_status": "unknown"
    },
    {
      "evidence_id": "E8",
      "claim": "The surviving sources are not contemporaneous policy records: key narrative accounts were written many decades after the decision and may contain literary, political or retrospective distortion.",
      "epistemic_status": "observed"
    }
  ],
  "known_uncertainties": [
    "The reliability of later claims about Claudius' motives, including personal prestige.",
    "The exact identity and political claim of Bericus and what obligations Rome believed it owed him.",
    "Whether Britain posed specific security threats not preserved in the surviving record.",
    "Which British polities might prefer alliance with Rome and which would resist.",
    "The expected scale of casualties, enslavement, tribute and long-term occupation before the invasion begins."
  ],
  "known_alternatives": [
    "Diplomatic negotiation concerning deserters and disputed cross-Channel obligations.",
    "Limited support for a claimant without annexing or subjugating unrelated British peoples.",
    "Defensive preparation in Gaul/Channel areas if a concrete British threat exists.",
    "No military intervention absent stronger evidence of necessity."
  ],
  "requested_output": [
    "Assess whether the recorded grounds are sufficient to justify large-scale invasion and political subjugation.",
    "Do not assume that Rome's superior power, organisation or possible future benefits create permission to rule non-consenting peoples.",
    "Treat the ancient sources' motive claims and omissions with explicit uncertainty.",
    "Assess proportionality between an exiled claimant/deserter dispute and general conquest.",
    "Give a Moral Code assessment while stating what missing historical evidence could materially change the result."
  ]
}
